rank,name,score,temperature,address,phone,website,rating,reviews,price_level,google_maps_url,types,city,category
1,La Fabrique,98,HOT,"Le Vallon, Kénitra, Maroc",06 69 18 21 81,,4.7,505,,https://maps.google.com/?cid=14684951787857075237,"establishment, food, point_of_interest, restaurant",kénitra,"restaurant, transport"
2,Villa Port Lyautey,97,HOT,"476 Av. Mohamed V, Kénitra 14000, Maroc",06 28 08 44 79,,4,377,,https://maps.google.com/?cid=2684349900379163845,"cafe, establishment, food, point_of_interest, restaurant, store",kénitra,"restaurant, transport"
3,Le Continental Mehdia,96,HOT,"1er, Residence la Perle de Mehdia, Entrée Corniche, Rte de Mehdia, Kénitra 14110, Maroc",06 66 51 07 08,,4.7,5138,,https://maps.google.com/?cid=14668302441214732645,"establishment, food, point_of_interest, restaurant",kénitra,"restaurant, transport"
4,Natsakhar lik livraison à domicile,95,HOT,"Lot 289 Bloc K Ouled Oujih Bureau Rue N°1, Kenitra 14000, Maroc",06 08 93 19 20,,4.5,121,,https://maps.google.com/?cid=4784463249511655520,"establishment, food, meal_delivery, point_of_interest",kénitra,"restaurant, transport"
5,Mille Délices,93,HOT,"Atlantic centre, Av. Mohamed V, Kénitra 14010, Maroc",05 37 36 71 95,,4,156,,https://maps.google.com/?cid=5546753250723448702,"bar, establishment, food, point_of_interest, restaurant",kénitra,"restaurant, transport"
6,Resto Santé,91,HOT,"352 Avenue E, Kénitra, Maroc",05 37 32 23 96,,4.3,77,,https://maps.google.com/?cid=18409902925396462705,"establishment, food, point_of_interest, restaurant",kénitra,"restaurant, transport"
7,Snack Et Restaurant Tanjawi,87,HOT,"7C67+69V, Rue Salah Eddine, Kénitra, Maroc",06 60 12 11 09,,3.6,94,,https://maps.google.com/?cid=11586940308867540921,"establishment, food, point_of_interest, restaurant",kénitra,"restaurant, transport"
8,Quick Kénitra,86,HOT,"553 Av. Mohamed V, Kénitra 14000, Maroc",05 37 39 50 51,https://www.quick.ma/,4.1,165,,https://maps.google.com/?cid=8681744044566406154,"establishment, food, point_of_interest, restaurant",kénitra,"restaurant, transport"
9,Tendy's,85,HOT,"Ave des FAR, Kenitra 14000, Maroc",06 64 97 08 02,http://www.tendys.ma/,4.4,264,,https://maps.google.com/?cid=1776020283641409020,"establishment, food, point_of_interest, restaurant",kénitra,"restaurant, transport"
10,B&B Park,85,HOT,"Av. Hassan II, Kénitra, Maroc",05 37 37 06 24,https://bandbpark.ma/,4.2,1428,2,https://maps.google.com/?cid=7046529347143226412,"establishment, food, point_of_interest, restaurant",kénitra,"restaurant, transport"
11,Merzouga restaurant,84,HOT,"1 ére, Rte de Mehdia, Kenitra, Maroc",05 37 38 89 71,http://www.merzougarestaurant.com/,4,2630,2,https://maps.google.com/?cid=16215019738260312875,"establishment, food, point_of_interest, restaurant",kénitra,"restaurant, transport"
12,Choose,84,HOT,"Angle Avenue Med Diouri et Mbark Doukkali, Résidence Marina, Bloc D magasin 138, Kénitra 14000, Maroc",06 50 97 88 63,https://www.instagram.com/choose.morocco/,4.4,203,,https://maps.google.com/?cid=4215051363451821077,"establishment, food, point_of_interest, restaurant",kénitra,"restaurant, transport"
13,Le Relais de l'Atlantique : Café & Restaurant,83,HOT,"1er Mehdia plage, residence de l'Atlantique 1, Kénitra 14000, Maroc",08 08 63 48 31,http://www.relaisdelatlantique.com/,4.7,422,,https://maps.google.com/?cid=11183498759706066612,"cafe, establishment, food, point_of_interest, restaurant",kénitra,"restaurant, transport"
14,Restaurant La Pausa,83,HOT,"39 angle boulevard mly abdelaziz & Mly abderrahmane magasin 10, Kenitra 14000, Maroc",08 08 54 17 28,http://www.lapausakenitra.com/,4,227,,https://maps.google.com/?cid=10197836966298116449,"establishment, food, point_of_interest, restaurant",kénitra,"restaurant, transport"
15,Livreur kenitra trè fast,82,HOT,"رقم 76, شارع مولاي عبد الرحمان, Kénitra 14020, Maroc",06 07 92 84 81,,4.6,44,,https://maps.google.com/?cid=2396580518879180397,"establishment, food, meal_delivery, point_of_interest",kénitra,"restaurant, transport"
16,Café Restaurant Tres Forcas Officiel,82,HOT,"Résidence Aymane, 465 Av. Mohamed V, Kénitra 14000, Maroc",06 23 21 28 34,https://www.facebook.com/CafeRestaurantTresForcasOfficiel/,4.1,384,2,https://maps.google.com/?cid=5878290944390300219,"cafe, establishment, food, point_of_interest, restaurant",kénitra,"restaurant, transport"
17,RESTAURANT CAFE LIN'S,82,HOT,"ang, Eddahbi et Jamal, Rue Mansour Dahbi, Kénitra 14000, Maroc",05 37 36 00 86,https://instagram.com/lins_restaurant_coffee?igshid=YmMyMTA2M2Y=,3.8,124,,https://maps.google.com/?cid=5769210815567812235,"establishment, food, point_of_interest, restaurant",kénitra,"restaurant, transport"
18,Ryad Naji,81,HOT,"2 Rue Sebou, Kénitra, Maroc",05 37 36 45 75,http://ryadnaji.ma/,3.9,596,2,https://maps.google.com/?cid=11912943116142759877,"establishment, food, point_of_interest, restaurant",kénitra,"restaurant, transport"
19,House 17,81,HOT,"130, immeuble Baraka A, angle Av. Moulay Abderrahmane, Kénitra 14000, Maroc",05 30 16 22 59,https://www.instagram.com/houseventeen?igsh=YTd3bHV2MjNpdWpn,4.3,78,,https://maps.google.com/?cid=6632163255587930521,"cafe, establishment, food, point_of_interest, restaurant, store",kénitra,"restaurant, transport"
20,Kenitra,74,WARM,"1er étage، Rés. Nour، 45 Lot. Soufiane، الدار البيضاء 20250, Maroc",06 08 81 32 86,,4.7,6,,https://maps.google.com/?cid=9817817034830318939,"establishment, food, point_of_interest, restaurant",kénitra,"restaurant, transport"
